{
  "$schema": "https://json-schema.org/draft/2020-12/schema",
  "$id": "https://mcp-2099.local/contracts/agent-platform/v1/agent-profile.schema.json",
  "title": "AgentProfile",
  "type": "object",
  "additionalProperties": false,
  "required": ["id", "version", "name", "description", "inputSchema", "resultSchema", "workflow"],
  "properties": {
    "id": { "type": "string", "minLength": 1 },
    "version": { "type": "string", "pattern": "^[0-9]+\\.[0-9]+\\.[0-9]+$" },
    "name": { "type": "string", "minLength": 1 },
    "description": { "type": "string", "minLength": 1 },
    "inputSchema": { "type": "object", "additionalProperties": true },
    "uiSchema": { "type": "object", "additionalProperties": true },
    "resultSchema": { "type": "object", "additionalProperties": true },
    "workflow": {
      "type": "object",
      "additionalProperties": false,
      "required": ["id", "version", "allowedRoles"],
      "properties": {
        "id": { "type": "string", "minLength": 1 },
        "version": { "type": "string", "pattern": "^[0-9]+\\.[0-9]+\\.[0-9]+$" },
        "allowedRoles": { "type": "array", "minItems": 1, "items": { "type": "string", "minLength": 1 }, "uniqueItems": true }
      }
    },
    "metrics": { "type": "array", "items": { "type": "object", "additionalProperties": true } },
    "actions": { "type": "array", "items": { "type": "object", "additionalProperties": true } }
  }
}
